"PMLA court orders liquidation of Vijay Mallya’s Rs 11,000-cr assets to clear debt"," 1 January, 2020 2:35 pm IST",Ananya Bhardwaj,"SBI, Vijay Mallya",https://theprint.in/india/mumbai-court-allows-sbi-led-consortium-of-banks-to-liquidate-vijay-mallyas-assets-to-clear-debt/343334/
"Introduce on-demand exams at undergraduate level, UGC panel tells Modi govt"," 1 January, 2020 1:28 pm IST",Kritika Sharma,"higher education, HRD Ministry, UGC",https://theprint.in/india/education/introduce-on-demand-exams-at-undergraduate-level-ugc-panel-tells-modi-govt/343099/
"Week after death of Varanasi boy during CAA protest, family yet to get post-mortem report"," 1 January, 2020 12:31 pm IST",Fatima Khan,"CAA protests, Citizenship Amendment Act, Varanasi",https://theprint.in/india/week-after-death-of-varanasi-boy-during-caa-protest-family-yet-to-get-post-mortem-report/342935/
Why women of Karnataka’s Kodagu are busy learning how to use a rifle," 1 January, 2020 11:32 am IST",Rohini Swamy,"Firearms, Karnataka, Kodagu",https://theprint.in/india/why-women-of-karnatakas-kodagu-are-busy-learning-how-to-use-a-rifle/342888/
Mukesh Ambani unveils e-commerce platform to take on Amazon & Flipkart," 1 January, 2020 11:17 am IST",P. R. Sanjai,"Bloomberg wire, Mukesh Ambani, Reliance Industries",https://theprint.in/india/mukesh-ambani-unveils-e-commerce-platform-to-take-on-amazon-flipkart/343251/
"$5 trillion economy in mind, PM Modi set to begin 2020 with review of ministries’ 5-yr plans"," 1 January, 2020 11:01 am IST",Sanya Dhingra,"Indian Economy, Narendra Modi, Nirmala Sitharaman",https://theprint.in/economy/5-trillion-economy-in-mind-pm-modi-set-to-begin-2020-with-review-of-ministries-5-yr-plans/343246/
"To cut cost, PM Modi cuts size of his personal staff by almost 50%, PMO by at least 15%  "," 1 January, 2020 10:32 am IST",Moushumi Das Gupta,"Modi foreign trips, Narendra Modi, PMO",https://theprint.in/india/governance/to-cut-cost-pm-modi-cuts-size-of-his-personal-staff-by-almost-50-pmo-by-at-least-15/342987/
Passport verification in J&K now involves ‘informal interviews’ at police stations," 1 January, 2020 9:29 am IST",Azaan Javaid,"Jammu and Kashmir, Passport office",https://theprint.in/india/passport-verification-in-jk-now-involves-informal-interviews-at-police-stations/342984/
"412 booked under Public Safety Act since 5 August, says report by Kashmir-based rights group"," 31 December, 2019 8:24 pm IST",Azaan Javaid,"Article 370, Jammu and Kashmir, Kashmir",https://theprint.in/india/412-booked-under-public-safety-act-since-5-august-says-report-by-kashmir-based-rights-group/343140/
"SMS service, broadband internet in govt hospitals restored in Kashmir at midnight"," 31 December, 2019 8:24 pm IST",PTI,"Article 370, Jammu & Kashmir, PTI wire",https://theprint.in/india/broadband-internet-to-be-restored-in-govt-hospitals-in-kashmir-from-31-december-midnight/343208/
Railways announce fair hike effective from 1 January 2020," 31 December, 2019 7:53 pm IST",PTI,"Indian Railways, PTI wire",https://theprint.in/india/railways-announce-fair-hike-effective-from-1-january-2020/343185/
"Mamata carries out major police reshuffle in Bengal, transfers 68 IPS officers in two days"," 31 December, 2019 7:53 pm IST",Madhuparna Das,"IPS officers, Mamata Banerjee, TMC, West Bengal",https://theprint.in/india/governance/mamata-carries-out-major-police-reshuffle-in-bengal-transfers-68-ips-officers-in-two-days/343179/
Railways renames RPF as Indian Railway Protection Force Service," 31 December, 2019 6:10 pm IST",PTI,"Indian Railways, PTI wire",https://theprint.in/india/railways-renames-rpf-as-indian-railway-protection-force-service/343141/
Delhi govt to rename Pragati Maidan metro station after Supreme Court," 31 December, 2019 5:31 pm IST",PTI,"Delhi government, Pragati Maidan, PTI wire, Supreme Court",https://theprint.in/india/governance/delhi-govt-to-rename-pragati-maidan-metro-station-after-supreme-court/343095/
Indore remains India’s cleanest city for the fourth year," 31 December, 2019 5:25 pm IST",PTI,"Indore, PTI wire, Surat",https://theprint.in/india/indore-remains-indias-cleanest-city-for-the-fourth-year/343045/
"Shiv Sena MP, BJP MLA booked for attempt to murder amid panchayat polls in Maharashtra"," 31 December, 2019 4:31 pm IST",PTI,"BJP, PTI wire, Shiv Sena",https://theprint.in/india/shiv-sena-mp-bjp-mla-booked-for-attempt-to-murder-amid-panchayat-polls-in-maharashtra/343034/
Delhi court grants interim bail to two in Seelampur violence case on medical grounds," 31 December, 2019 4:29 pm IST",PTI,"CAA, Citizenship Bill protests, PTI wire",https://theprint.in/india/delhi-court-grants-interim-bail-to-two-in-seelampur-violence-case-on-medical-grounds/343022/
India’s Huawei bet to ‘pacify China’ is set to be next thorn in India-US ties," 31 December, 2019 4:01 pm IST",Nayanima Basu,"5G, 5G network, China, Huawei, US",https://theprint.in/diplomacy/indias-huawei-bet-to-pacify-china-is-set-to-be-next-thorn-in-india-us-ties/342973/
Varanasi toddler hasn’t been breastfed for days as parents were arrested during CAA protest," 31 December, 2019 2:21 pm IST",Fatima Khan,"Citizenship Amendment Act protests, PM Modi, Varanasi",https://theprint.in/india/varanasi-toddler-hasnt-been-breastfed-for-days-as-parents-were-arrested-during-caa-protest/342853/
Huawei thanks Modi govt after being allowed to participate in 5G trials," 31 December, 2019 2:00 pm IST",K J M Varma,"5G, Huawei, PTI wire",https://theprint.in/india/huawei-thanks-modi-govt-after-being-allowed-to-participate-in-5g-trials/342884/
"Car in Karnataka CM Yediyurappa’s convoy rams into truck, two injured in mishap"," 31 December, 2019 2:00 pm IST",PTI,"B. S. Yediyurappa, Karnataka, PTI wire",https://theprint.in/india/car-in-karnataka-cm-yediyurappas-convoy-rams-into-truck-two-injured-in-mishap/342876/
Prateek Kuhad’s ‘Cold/Mess’ makes it to Barack Obama’s list of 2019’s favourite music," 31 December, 2019 1:59 pm IST",Unnati Sharma,"Barack Obama, Music bands",https://theprint.in/india/prateek-kuhads-cold-mess-makes-it-to-barack-obamas-list-of-2019s-favourite-music/342878/
"Eye on $5 trillion economy, PM wants ministries to set goals with global standards in mind"," 31 December, 2019 1:31 pm IST",Moushumi Das Gupta,"Human Resource Development (HRD) ministry, Narendra Modi, Pradhan Mantri Awas Yojana",https://theprint.in/india/eye-on-5-trillion-economy-pm-wants-ministries-to-set-goals-with-global-standards-in-mind/342500/
Modi govt supports Zero Budget Natural Farming but doesn’t have enough budget to promote it," 31 December, 2019 11:40 am IST",Samyak Pandey,"Agriculture, Modi government, Organic farming, Zero budget farming",https://theprint.in/india/governance/modi-govt-supports-zero-budget-natural-farming-but-doesnt-have-enough-budget-to-promote-it/342570/
Hinduja brothers preparing bid to buy grounded Jet Airways," 31 December, 2019 11:34 am IST",Bijou George,"Bloomberg wire, Hinduja, Jet Airways",https://theprint.in/india/hinduja-brothers-preparing-bid-to-buy-grounded-jet-airways/342800/
Yogi govt wants public to pay damages for protest but order violates Supreme Court judgment," 31 December, 2019 9:30 am IST",Apoorva Mandhani,"CAA protests, CM Yogi Adityanath, UP Government",https://theprint.in/india/yogi-govt-wants-public-to-pay-damages-for-protest-but-order-violates-supreme-court-judgment/342620/
"New home for PM, a triangular Parliament — Modi govt readies Delhi power corridor makeover"," 30 December, 2019 9:21 pm IST",Moushumi Das Gupta,,https://theprint.in/india/governance/new-home-for-pm-a-triangular-parliament-modi-govt-readies-delhi-power-corridor-makeover/342758/
India recalls Ambassador to Austria Renu Pall over financial irregularities," 30 December, 2019 9:05 pm IST",ANI,"ANI wire, Austria, MEA",https://theprint.in/india/india-recalls-ambassador-to-austria-renu-pall-over-financial-irregularities/342760/
"Minor fire breaks out at PM’s house complex, Modi’s residence and office unaffected"," 30 December, 2019 8:49 pm IST",PTI,"Narendra Modi, PMO, PTI wire, SPG",https://theprint.in/india/minor-fire-breaks-out-at-pms-house-complex-modis-residence-and-office-unaffected/342749/
"Kerala tops Niti Aayog’s Sustainable Development Goals index, Bihar takes the last spot"," 30 December, 2019 8:27 pm IST",PTI,"Bihar, Kerala, Niti Aayog, PTI wire",https://theprint.in/india/kerala-tops-niti-aayogs-sustainable-development-goals-index-bihar-takes-the-last-spot/342735/
"Railways property worth Rs 80 crore damaged in CAA protests, to recover money from ‘guilty’"," 30 December, 2019 8:04 pm IST",PTI,"CAA protests, PTI wire, Railways",https://theprint.in/india/governance/railways-property-worth-rs-80-crore-damaged-in-caa-protests-to-recover-money-from-guilty/342604/
"Home Ministry extends AFSPA in Nagaland for 6 months, declares entire state ‘disturbed’"," 30 December, 2019 8:04 pm IST",PTI,"AFSPA, Nagaland, PTI wire",https://theprint.in/india/home-ministry-extends-afspa-in-nagaland-for-6-months-declares-entire-state-disturbed/342717/
"Cops arrest 3 in East Midnapore church vandalism case, say they could be BJP supporters"," 30 December, 2019 7:38 pm IST",PTI,"BJP, PTI wire, West Bengal",https://theprint.in/india/cops-arrest-3-in-east-midnapore-church-vandalism-case-say-they-could-be-bjp-supporters/342676/
"5 J&K politicians released, administration now hopes for resumption of political activity"," 30 December, 2019 6:30 pm IST",Azaan Javaid,"Article 370, Jammu & Kashmir",https://theprint.in/india/5-kashmiri-political-leaders-released-after-being-detained-in-august/342649/
"CBI raids homes, offices of IAS and KAS officers in 2018 arms licence case"," 30 December, 2019 4:32 pm IST",Ananya Bhardwaj,"CBI, IAS, Jammu and Kashmir",https://theprint.in/india/governance/cbi-raids-homes-offices-of-ias-and-kas-officers-in-2018-arms-licence-case/342589/
Anti-CAA ‘kolam’ outside DMK chief MK Stalin’s house day after 8 detained for the same," 30 December, 2019 3:45 pm IST",PTI,"CAA, Chennai, Citizenship Bill protests, MK Stalin, PTI wire",https://theprint.in/india/anti-caa-kolam-outside-dmk-chief-mk-stalins-house-day-after-8-detained-for-the-same/342545/
"Heavy fog in Delhi delays 530 flights, causes 20 diversions, 4 cancelled"," 30 December, 2019 2:13 pm IST",PTI,"Indigo, PTI wire, Vistara, Weather",https://theprint.in/india/heavy-fog-in-delhi-delays-530-flights-causes-20-diversions-4-cancelled/342512/
‘Not sorry’ — ex-constable arrested for ‘shoot protesters’ remark says he did nothing wrong," 30 December, 2019 1:56 pm IST",Ananya Bhardwaj,"CAA protests, Delhi police, Uttar Pradesh, Yogi Adityanath",https://theprint.in/india/not-sorry-ex-constable-arrested-for-shoot-protesters-remark-says-he-did-nothing-wrong/342464/
Ajit Pawar sworn in as deputy CM as Uddhav Thackeray expands his Maharashtra cabinet," 30 December, 2019 1:50 pm IST",PTI,"Maharashtra elections 2019, PTI wire",https://theprint.in/india/ajit-pawar-sworn-in-as-deputy-cm-as-uddhav-thackeray-expands-his-maharashtra-cabinet/342497/
CRPF says no breach in Priyanka Gandhi’s security during visit to Lucknow," 30 December, 2019 1:21 pm IST",PTI,"CRPF, Priyanka Gandhi Vadra, PTI wire, VIP security cover",https://theprint.in/india/crpf-says-no-breach-in-priyanka-gandhis-security-during-visit-to-lucknow/342461/
"Arvind Kejriwal govt to pay board exam fees for schools run by NDMC, Delhi Cantonment"," 30 December, 2019 12:59 pm IST",PTI,"AAP government, Arvind Kejriwal, PTI wire",https://theprint.in/india/arvind-kejriwal-govt-to-pay-board-exam-fees-for-schools-run-by-ndmc-delhi-cantonment/342466/
"To assess women empowerment, NITI Aayog to come up with nationwide gender index"," 30 December, 2019 12:30 pm IST",Sanya Dhingra,"Niti Aayog, Women and Child Development Ministry, women empowerment",https://theprint.in/india/to-assess-women-empowerment-niti-aayog-to-come-up-with-nationwide-gender-index/342232/
Modi govt’s Rightward lurch is self-defeating," 30 December, 2019 11:42 am IST",Mihir Sharma,"Bloomberg wire, Modi government, Narendra Modi",https://theprint.in/india/modi-govts-rightward-lurch-is-self-defeating/342435/
How the Right is tackling Left’s intellectual hegemony in Delhi — one think-tank at a time," 30 December, 2019 10:33 am IST",Srijan Shukla,"BJP, RSS, think tanks",https://theprint.in/india/how-the-right-is-tackling-lefts-intellectual-hegemony-in-delhi-one-think-tank-at-a-time/341760/
6 dead after car falls into canal in Greater Noida due to fog," 30 December, 2019 9:12 am IST",PTI,"PTI wire, Road accidents",https://theprint.in/india/6-dead-after-car-falls-into-canal-in-greater-noida-due-to-fog/342414/
"Loving freely, right to privacy, NOTA, Ram Mandir — 10 historic SC judgments of the decade"," 30 December, 2019 8:46 am IST",Debayan Roy,"National Register of Citizens, Ranjan Gogoi, Supreme Court, The Year 2019",https://theprint.in/india/governance/judiciary/loving-freely-right-to-privacy-nota-ram-mandir-10-historic-sc-judgments-of-the-decade/341667/
"Services rules amended for Army, Navy and Air Force, CDS can serve till 65"," 29 December, 2019 7:44 pm IST",Snehesh Alex Philip,"Chief of Defence Staff, Defence Ministry, Modi PMO",https://theprint.in/india/services-rules-amended-for-army-navy-and-air-force-cds-can-serve-till-65/342360/
‘Won’t fill NPR form’ — former UP CM Akhilesh Yadav says BJP can’t decide citizenship," 29 December, 2019 7:38 pm IST",PTI,"Akhilesh Yadav, CAA-NRC, NPR, PTI wire",https://theprint.in/india/wont-fill-npr-form-former-up-cm-akhilesh-yadav-says-bjp-cant-decide-citizenship/342369/
Haryana govt transfers 51 IAS officers with immediate effect," 29 December, 2019 7:34 pm IST",PTI,"Haryana IAS officers, Modi government, PTI wire",https://theprint.in/india/haryana-govt-transfers-51-ias-officers-with-immediate-effect/342365/
Aligarh society alleges use of force on IHC members opposing Kerala Governor speech," 29 December, 2019 7:17 pm IST",PTI,"CAA protests, Kerala Governor, NRC, PTI wire",https://theprint.in/india/aligarh-society-alleges-use-of-force-on-ihc-members-opposing-kerala-governor-speech/342352/
Home Minister Amit Shah unveils new insignia for CRPF’s VIP security wing," 29 December, 2019 7:07 pm IST",PTI,"Amit Shah, CRPF, PTI wire",https://theprint.in/india/home-minister-amit-shah-unveils-new-insignia-for-crpfs-vip-security-wing/342355/
Indian Navy to build fleet of 18 conventional & six nuclear attack submarines," 29 December, 2019 6:44 pm IST",ANI,"ANI wire, Indian Navy, nuclear-powered submarine",https://theprint.in/india/indian-navy-to-build-fleet-of-18-conventional-six-nuclear-attack-submarines/342320/
Ayodhya to gau raksha — Modi consulted Karnataka seer Vishwesha Teertha Swami since 1992," 29 December, 2019 6:33 pm IST",Rohini Swamy,"Narendra Modi, Udupi temple, Vishwesha Theertha Swami",https://theprint.in/india/ayodhya-to-gau-raksha-modi-consulted-karnataka-seer-vishwesha-teertha-swami-since-1992/342331/
Amitabh Bachchan to receive Dada Saheb Phalke Award today," 29 December, 2019 4:33 pm IST",ANI,"Amitabh Bachchan, ANI wire, Dada Saheb Phalke Award",https://theprint.in/india/amitabh-bachchan-to-receive-dada-saheb-phalke-award-today/342316/
"Delhi hospitals not giving medical reports, say families of UP men killed in ‘police firing’"," 29 December, 2019 4:04 pm IST",Jyoti Yadav,"Citizenship Amendment Act protests, UP Police, Uttar Pradesh",https://theprint.in/india/delhi-hospitals-not-giving-medical-reports-say-families-of-up-men-killed-in-police-firing/342207/
Mulayam Singh Yadav in Mumbai hospital for ‘abdominal complaints’," 29 December, 2019 4:00 pm IST",PTI,"Mulayam Singh Yadav, PTI wire, Samajwadi Party",https://theprint.in/india/mulayam-singh-yadav-in-mumbai-hospital-for-abdominal-complaints/342300/
"Hemant Soren sworn in as 11th chief minister of Jharkhand, Mamata, Rahul attend ceremony"," 29 December, 2019 3:37 pm IST",PTI,"Hemant Soren, Jharkhand assembly election, PTI wire",https://theprint.in/india/hemant-soren-sworn-in-as-11th-chief-minister-of-jharkhand-mamata-rahul-attend-ceremony/342292/
"Inspection report of scam-hit PMC Bank yet to be finalised, says RBI"," 29 December, 2019 3:16 pm IST",Ashwini Shrivastava,"PMC Bank scam, PTI wire, RBI",https://theprint.in/india/inspection-report-of-scam-hit-pmc-bank-yet-to-be-finalised-says-rbi/342281/
"In Yogi bastion Gorakhpur, residents say police strictly obeying CM’s ‘revenge’ statement"," 29 December, 2019 2:59 pm IST",Fatima Khan,"CAA protests, Gorakhpur, Yogi Adityanath",https://theprint.in/india/in-yogi-bastion-gorakhpur-residents-say-police-strictly-obeying-cms-revenge-statement/342216/
"NRC is an ‘internal affair’ of Indian govt, says chief of Border Guards Bangladesh"," 29 December, 2019 2:19 pm IST",PTI,"Border Guards Bangladesh, NRC, PTI wire",https://theprint.in/india/nrc-is-an-internal-affair-of-indian-govt-says-chief-of-border-guards-bangladesh/342226/
"Youth of India hate anarchy, they are irritated by disorder & instability, says PM Modi"," 29 December, 2019 1:55 pm IST",ANI,"ANI wire, Mann Ki Baat, Narendra Modi",https://theprint.in/india/youth-of-india-hate-anarchy-they-are-irritated-by-disorder-instability-says-pm-modi/342204/
8 people protesting with anti-CAA-NRC rangoli detained in Chennai," 29 December, 2019 1:32 pm IST",PTI,"CAA protests, CAA-NRC, PTI wire",https://theprint.in/india/8-people-protesting-with-anti-caa-nrc-rangoli-detained-in-chennai/342196/
"Nationwide NRC will harm Adivasis the most, says Chhattisgarh CM Bhupesh Baghel"," 29 December, 2019 12:14 pm IST",ANI,"ANI wire, Bhupesh Baghel, Nationwide NRC",https://theprint.in/india/nationwide-nrc-will-harm-adivasis-the-most-says-chhattisgarh-cm-bhupesh-baghel/342170/
Only those who say Bharat Mata Ki Jai will stay in India: Union minister Dharmendra Pradhan," 29 December, 2019 12:07 pm IST",ANI,"ABVP, Dharmendra Pradhan, PTI wire",https://theprint.in/india/only-those-who-say-bharat-mata-ki-jai-will-stay-in-india-union-minister-dharmendra-pradhan/342169/
"Swami Vishwesha Teertha of Pejawar Math dies in Udupi, PM Modi condoles death"," 29 December, 2019 11:37 am IST",ANI,"ANI wire, Prime Minister Narendra Modi, Ram Janmabhoomi",https://theprint.in/india/swami-vishwesha-teertha-of-pejawar-math-dies-in-udupi-pm-modi-condoles-death/342144/
Minority Affairs Minister Naqvi demands ‘immediate action’ against UP cop’s ‘go to Pakistan’ comment," 29 December, 2019 11:30 am IST",ANI,"CAA protests, Mukhtar Abbas Naqvi, PTI wire, UP Police",https://theprint.in/india/minority-affairs-minister-naqvi-demands-immediate-action-against-up-cops-go-to-pakistan-comment/342141/
UP Police rejects Priyanka Gandhi’s allegations of manhandling in Lucknow," 29 December, 2019 11:16 am IST",PTI,"CAA protests, Priyanka Gandhi, PTI wire, UP Police",https://theprint.in/india/up-police-rejects-priyanka-gandhis-allegations-of-manhandling-in-lucknow/342135/
"Amit Shah visits ITBP HQ, reviews operational preparedness along China border"," 28 December, 2019 7:01 pm IST",PTI,"Amit Shah, ITBP, PTI wire",https://theprint.in/india/amit-shah-visits-itbp-hq-reviews-operational-preparedness-along-china-border/342098/
Dalit man’s shop set on fire in MP village after his inter-caste marriage," 28 December, 2019 6:35 pm IST",PTI,"inter-caste marriage, PTI wire",https://theprint.in/india/dalit-mans-shop-set-on-fire-in-mp-village-after-his-inter-caste-marriage/342088/
Delhi court to hear bail plea of 15 accused in Daryaganj protests on 7 January," 28 December, 2019 6:26 pm IST",ANI,"ANI wire, bail plea, CAA, Daryaganj",https://theprint.in/india/delhi-court-to-hear-bail-plea-of-15-accused-in-daryaganj-protests-on-7-january/342082/
‘Children are dying’ — Paswan accuses Kejriwal of politicising Delhi’s water crisis," 28 December, 2019 6:23 pm IST",PTI,"Arvind Kejriwal, PTI wire, Ram Vilas Paswan",https://theprint.in/india/children-are-dying-paswan-accuses-kejriwal-of-politicising-delhis-water-crisis/342080/
AMU students invite cops for iftar after daylong fast for victims of CAA protest violence," 28 December, 2019 6:07 pm IST",PTI,"AMU, CAA, Citizenship Bill protests, iftaar, PTI wire, Student protests, UP Police",https://theprint.in/india/amu-students-invite-cops-for-iftar-after-daylong-fast-for-victims-of-caa-protest-violence/342078/
"Don’t implement NPR, Yechury urges Chandrasekhar Rao and other CMs"," 28 December, 2019 5:58 pm IST",PTI,"NPR, PTI wire, Sitaram Yechury",https://theprint.in/india/dont-implement-npr-yechury-urges-chandrasekhar-rao-and-other-cms/342077/
"After ‘go to Pakistan’ video goes viral, Meerut SP says protesters were raising anti-India slogans"," 28 December, 2019 5:16 pm IST",Prashant Srivastava,"CAA, Go to Pakistan, UP Police",https://theprint.in/india/after-go-to-pakistan-video-goes-viral-meerut-sp-says-protesters-were-raising-anti-india-slogans/342057/
Editors Guild slams BJP’s Amit Malviya for ‘McCarthyist’ Twitter poll on Rajdeep Sardesai," 28 December, 2019 4:59 pm IST",ThePrint Team,"Amit Malviya, Editors Guild of India, rajdeep sardesai",https://theprint.in/india/editors-guild-slams-bjps-amit-malviya-for-mccarthyist-twitter-poll-on-rajdeep-sardesai/342049/
‘For peace on campus’ — IIT-Kanpur students’ e-magazine asked to take down article on CAA," 28 December, 2019 3:26 pm IST",Prashant Srivastava,"CAA, Citizenship Bill protests, IIT Kanpur, Student protests",https://theprint.in/india/for-peace-on-campus-iit-kanpur-students-e-magazine-asked-to-take-down-article-on-caa/342000/
Panel to probe damage to public property during anti-CAA protests in Muzaffarnagar," 28 December, 2019 2:54 pm IST",PTI,"CAA, Citizenship Bill protests, Muzaffarnagar, PTI wire",https://theprint.in/india/panel-to-probe-damage-to-public-property-during-anti-caa-protests-in-muzaffarnagar/341985/
"Farmers with more than Rs 2-lakh loan not eligible for waiver, says Uddhav Thackeray govt"," 28 December, 2019 2:28 pm IST",PTI,"Farm loan waivers, PTI wire, Uddhav Thackeray",https://theprint.in/india/farmers-with-more-than-rs-2-lakh-loan-not-eligible-for-waiver-says-uddhav-thackeray-govt/341969/
"Path to honesty is tortuous, sometimes damaging: Election Commissioner Ashok Lavasa"," 28 December, 2019 1:04 pm IST",Sanya Dhingra,"Ashok Lavasa, Modi govt 2019",https://theprint.in/india/path-to-honesty-is-tortuous-sometimes-damaging-election-commissioner-ashok-lavasa/341931/
410 vacancies but govt sat on names — why 2019 wasn’t a good year for judge appointments," 28 December, 2019 12:37 pm IST",Debayan Roy,"Chief Justice of India, Justice Kureshi, Supreme Court, The Year 2019",https://theprint.in/india/governance/judiciary/410-vacancies-but-govt-sat-on-names-why-2019-wasnt-a-good-year-for-judge-appointments/341134/
Weightlifter Seema handed 4-year suspension for doping," 28 December, 2019 12:31 pm IST",PTI,"Anti-doping, PTI wire, WADA",https://theprint.in/india/weightlifter-seema-handed-4-year-suspension-for-doping/341921/
"Army rescues 1,500 tourists stranded in Sikkim’s Nathu La due to heavy snowfall"," 28 December, 2019 12:08 pm IST",PTI,"ARMY, PTI wire, Sikkim",https://theprint.in/india/army-rescues-1500-tourists-stranded-in-sikkims-nathu-la-due-to-heavy-snowfall/341919/
‘Police brutality videos need verification’ — UP DGP says CAA protesters used illegal arms," 28 December, 2019 11:51 am IST",Fatima Khan,"Citizenship Amendment Act protests, Uttar Pradesh Police",https://theprint.in/india/police-brutality-videos-need-verification-up-dgp-says-caa-protesters-used-illegal-arms/341894/
"At 2.4 degrees, Delhi sees coldest day of the season, 4 flights diverted due to fog"," 28 December, 2019 10:57 am IST",PTI,"Delhi, PTI wire, winters",https://theprint.in/india/at-2-4-degrees-delhi-sees-coldest-day-of-the-season-4-flights-diverted-due-to-fog/341892/
2 found dead after Saki Naka garment store fire in Mumbai," 28 December, 2019 10:45 am IST",PTI,"Mumbai fire, PTI wire",https://theprint.in/india/2-found-dead-after-saki-naka-garment-store-fire-in-mumbai/341889/
"Arun Jaitley’s close friends working to revive OPIUM — to ‘discuss, disagree, debate’ again"," 28 December, 2019 10:18 am IST",Maneesh Chhibber,"Arun Jaitley, CAA, dissent, Opium",https://theprint.in/india/arun-jaitleys-close-friends-working-to-revive-opium-to-discuss-disagree-debate-again/341749/
"Army chief General Rawat says armed forces have respect for human rights, laws"," 27 December, 2019 7:57 pm IST",PTI,"Citizenship Amendment Act, General Bipin Rawat, Indian Army, PTI wire",https://theprint.in/india/army-chief-general-rawat-says-armed-forces-have-respect-for-human-rights-laws/341752/
‘He didn’t answer CAA-NRC questions’ — why JU students ‘rusticated’ Chancellor Dhankhar," 27 December, 2019 6:20 pm IST",Kritika Sharma,"AMU, Citizenship Amendment Act protests, Jadavpur University, Jagdeep Dhankhar",https://theprint.in/india/education/he-didnt-answer-caa-nrc-questions-why-ju-students-rusticated-chancellor-dhankhar/341637/
Protesters agitating against ‘police atrocities’ detained outside Delhi’s UP Bhawan," 27 December, 2019 6:00 pm IST",PTI,"CAA protests, PTI wire, UP Police",https://theprint.in/india/protesters-agitating-against-police-atrocities-detained-outside-delhis-up-bhawan/341655/
"Hundreds, including political leaders, hold CAA protest at Jama Masjid in Delhi"," 27 December, 2019 5:18 pm IST",PTI,"Alka Lamba, CAA protests, Jama Masjid, PTI wire",https://theprint.in/india/hundreds-including-political-leaders-hold-caa-protest-at-jama-masjid-in-delhi/341642/
"In surprise order, Mamata makes ex-top cop Rajeev Kumar IT secretary — an IAS-cadre post"," 27 December, 2019 4:42 pm IST",Madhuparna Das,"Mamata Banerjee, Rajeev Kumar, West Bengal",https://theprint.in/india/governance/in-surprise-order-mamata-makes-ex-top-cop-rajeev-kumar-it-secretary-an-ias-cadre-post/341583/
