HRD secretary R. Subrahmanyam transferred over ‘JNU student protests’," 13 December, 2019 4:10 pm IST",Neelam Pandey,"HRD Ministry, IAS officers, JNU",https://theprint.in/india/governance/hrd-secretary-r-subrahmanyam-transferred-over-jnu-student-protests/334712/
"J&K govt shoots down delayed tourism projects, prioritises colleges, flats & industries"," 13 December, 2019 2:27 pm IST",Ananya Bhardwaj,"industry, Jammu and Kashmir, Tourism",https://theprint.in/india/jk-govt-shoots-down-delayed-tourism-projects-prioritises-colleges-flats-industries/334314/
Dehradun link to US Presidential race — UP constable’s IIT grad son living American dream," 13 December, 2019 1:06 pm IST",Simrin Sirur,"2020 US elections, Elizabeth Warren, Indian-Americans",https://theprint.in/india/the-dehradun-link-to-us-2020-race-an-iit-alum-up-constables-son-living-american-dream/334278/
Delhi court defers hearing plea on issuing death warrants against Nirbhaya case convicts," 13 December, 2019 12:58 pm IST",PTI,"Delhi Court, Nirbhaya case, Nirbhaya gangrape case, PTI wire",https://theprint.in/india/delhi-court-defers-hearing-plea-on-issuing-death-warrants-against-nirbhaya-case-convicts/334563/
Shinzo Abe’s visit to India uncertain as Assam unrest continues: Report," 13 December, 2019 12:39 pm IST",PTI,"Assam, Guwahati, PTI wire, Shinzo Abe",https://theprint.in/india/shinzo-abes-visit-to-india-uncertain-as-assam-unrest-continues-report/334491/
Tribals vs non-tribals — how the Jharkhand elections are likely to be decided," 13 December, 2019 11:33 am IST",Moushumi Das Gupta,"BJP, Congress, Jharkhand, Jharkhand assembly election, Raghubar Das",https://theprint.in/india/tribals-vs-non-tribals-how-the-jharkhand-elections-are-likely-to-be-decided/333389/
Nirbhaya gangrape victim’s mother moves Supreme Court against review plea by convict," 13 December, 2019 11:30 am IST",PTI,"Nirbhaya gangrape case, PTI wire, Supreme Court",https://theprint.in/india/nirbhaya-gangrape-victims-mother-moves-supreme-court-against-review-plea-by-convict/334487/
"Central police officers resume battle against IPS, this time in Delhi High Court"," 13 December, 2019 10:35 am IST",Sanya Dhingra,"CAPF, Delhi High Court, IPS",https://theprint.in/india/governance/judiciary/central-police-officers-resume-battle-against-ips-this-time-in-delhi-high-court/334269/
"India is modelling itself after Israel, Pakistan, China, not modern liberal democracies"," 13 December, 2019 10:14 am IST",Mihir Sharma,"Bloomberg wire, China, Citizenship Amendment Bill, Muslims, Pakistan",https://theprint.in/india/india-is-modelling-itself-after-israel-pakistan-china-not-modern-liberal-democracies/334431/
"Hyderabad rape case takes on caste colour, now other victims also want ‘prompt justice’"," 13 December, 2019 9:34 am IST",Prasad Nichenametla,"Asifabad, Hyderabad rape, telangana",https://theprint.in/india/hyderabad-rape-case-takes-on-caste-colour-now-other-victims-also-want-prompt-justice/334199/
Citizenship bill comes into effect after President Ram Nath Kovind’s nod," 13 December, 2019 9:08 am IST",PTI,"Citizenship (Amendment) Bill 2019, President Ram Nath Kovind, PTI wire",https://theprint.in/india/citizenship-bill-comes-into-effect-after-president-ram-nath-kovinds-nod/334428/
ED arrests ex-Fortis Healthcare promoter Shivinder Singh in money laundering case," 12 December, 2019 9:05 pm IST",PTI,"enforcement directorate, Fortis Healthcare, PTI wire, Shivinder Singh",https://theprint.in/india/ed-arrests-ex-fortis-healthcare-promoter-shivinder-singh-in-money-laundering-case/334327/
Woman given talaq alleges ‘tantrik’ raped her after husband wanted to remarry her," 12 December, 2019 9:02 pm IST",PTI,"PTI wire, Rape cases, triple talaq",https://theprint.in/india/woman-given-talaq-alleges-tantrik-raped-her-after-husband-wanted-to-remarry-her/334245/
74 deaths in 3 years puts spotlight back on avalanche danger for Indian Army," 12 December, 2019 8:39 pm IST",Amrita Nayak Dutta,"Indian Army, Siachen, Siachen Glacier",https://theprint.in/india/74-deaths-in-3-years-puts-spotlight-back-on-avalanche-danger-for-indian-army/334238/
Tara Sinha — Tough cookie who brought start-up culture to Indian advertising dies at 88," 12 December, 2019 8:36 pm IST",Shailaja Bajpai,"Advertising, Indian advertisements, Nestle",https://theprint.in/theprint-profile/tara-sinha-tough-cookie-who-brought-start-up-culture-to-indian-advertising-dies-at-88/334306/
2 die in Guwahati after police open fire on anti-citizenship bill protesters," 12 December, 2019 8:10 pm IST",PTI,"Citizenship (Amendment) Bill 2019, Guwahati, Northeast protests on Citizenship Bill, PTI wire",https://theprint.in/india/2-die-in-guwahati-after-police-open-fire-on-anti-citizenship-bill-protesters/334301/
"Lotus symbol on new passports part of enhanced security measures, says MEA"," 12 December, 2019 7:56 pm IST",PTI,"BJP, Lotus, MEA, Passports, PTI wire",https://theprint.in/india/lotus-symbol-on-new-passports-part-of-enhanced-security-measures-says-mea/334292/
HRD Ministry tells JNU to come up with ‘foolproof’ system to prevent another standoff," 12 December, 2019 7:18 pm IST",PTI,"HRD Ministry, JNU campus, JNU protests, PTI wire",https://theprint.in/india/education/hrd-ministry-tells-jnu-to-come-up-with-foolproof-system-to-prevent-another-standoff/334232/
Imran Khan asks world to ‘step in before it is too late’ after Indian Parliament clears CAB," 12 December, 2019 7:03 pm IST",PTI,"Citizenship (Amendment) Bill 2019, Imran Khan, Indian parliament, PTI wire",https://theprint.in/india/imran-khan-asks-world-to-step-in-before-it-is-too-late-after-indian-parliament-clears-cab/334264/
JNU vice-chancellor meets protesting students but deadlock over hostel fee hike remains," 12 December, 2019 6:30 pm IST",PTI,"JNU hostel fee hike, JNU protests, PTI wire",https://theprint.in/india/jnu-vice-chancellor-meets-protesting-students-but-deadlock-over-hostel-fee-hike-remains/334229/
Tihar jail searches for hangman for 16 December rapists as its own officers have refused," 12 December, 2019 5:11 pm IST",Ananya Bhardwaj,"hanging, Nirbhaya gangrape case, Tihar Jail",https://theprint.in/india/tihar-jail-searches-for-hangman-for-16-december-rapists-as-its-own-officers-have-refused/334115/
Supreme Court dismisses 18 petitions seeking review of Ayodhya verdict," 12 December, 2019 4:59 pm IST",PTI,"Ayodhya verdict, PTI wire, Supreme Court",https://theprint.in/india/governance/judiciary/supreme-court-dismisses-18-petitions-seeking-review-of-ayodhya-verdict/334143/
NIA top cop GP Singh off to Assam to ‘take charge’ as law and order deteriorates," 12 December, 2019 4:43 pm IST",Ananya Bhardwaj,"Assam, Citizenship Amendment Bill, NIA, Northeast protests on Citizenship Bill",https://theprint.in/india/nia-top-cop-gp-singh-off-to-assam-to-take-charge-as-law-and-order-deteriorates/334124/
Govt extends suspension of internet services in Assam by 48 hours as protests intensify," 12 December, 2019 3:48 pm IST",PTI,"Citizenship (Amendment) Bill 2019, Citizenship Bill protests, PTI wire",https://theprint.in/india/govt-extends-suspension-of-internet-services-in-assam-by-48-hours-as-protests-intensify/334099/
Students hold protest against Citizenship (Amendment) Bill at Delhi University’s Art Faculty," 12 December, 2019 3:46 pm IST",PTI,"Citizenship (Amendment) Bill 2019, Delhi University, PTI wire, Students protest",https://theprint.in/india/students-protest-citizenship-bill-at-delhi-university/334098/
Nirmala Sitharaman introduces bill to amend insolvency law amid opposition protests," 12 December, 2019 3:43 pm IST",PTI,"IBC amendment, Insolvency and Bankruptcy Code, Nirmala Sitharaman, PTI wire",https://theprint.in/india/governance/nirmala-sitharaman-introduces-bill-to-amend-insolvency-law-amid-opposition-protests/334101/
"Protests against citizenship bill continue in Guwahati despite curfew, police open fire"," 12 December, 2019 1:57 pm IST",PTI,"Assam, Citizenship Bill protests, Northeast protests on Citizenship Bill, PTI wire",https://theprint.in/india/protests-against-citizenship-bill-continue-in-guwahati-despite-curfew-police-open-fire/334049/
Indian Union Muslim League challenges citizenship bill in Supreme Court," 12 December, 2019 1:28 pm IST",PTI,"Citizenship Amendment Bill, IUML, PTI wire",https://theprint.in/india/indian-union-muslim-league-challenges-citizenship-bill-in-supreme-court/334012/
"Railways suspend train services to Tripura and Assam, deploys security personnel"," 12 December, 2019 1:20 pm IST",PTI,"Assam, Citizenship Amendment Bill, Northeast protests on Citizenship Bill, PTI wire",https://theprint.in/india/railways-suspend-train-services-to-tripura-and-assam-deploys-security-personnel/334010/
Supreme Court orders inquiry panel to look into Hyderabad ‘encounter’ of rape-murder accused," 12 December, 2019 1:00 pm IST",ThePrint Team,"Hyderabad rape, Supreme Court",https://theprint.in/india/governance/judiciary/supreme-court-orders-inquiry-panel-to-look-into-hyderabad-encounter-of-rape-murder-accused/334000/
"2018 National Film Awards to be given on 23 December, after 7-month delay"," 12 December, 2019 12:34 pm IST",Amrita Nayak Dutta,"National Film Awards, President Ram Nath Kovind, Venkaiah Naidu",https://theprint.in/india/2018-national-film-awards-to-be-given-on-23-december-after-7-month-delay/333570/
Kashmiris are dodging internet shutdown to watch Turkish ‘Game of Thrones’ to beat the blues," 12 December, 2019 11:36 am IST",Azaan Javaid,"Article 370, Internet shutdown, Jammu and Kashmir, Kashmir",https://theprint.in/india/kashmiris-are-dodging-internet-shutdown-to-watch-turkish-game-of-thrones-to-beat-the-blues/333757/
"Mid-day meal coverage sees a dip, govt says students are shifting to private schools"," 12 December, 2019 10:29 am IST",Tarun Krishna,"Education, HRD Ministry, midday meal scheme, Private schools",https://theprint.in/india/mid-day-meal-coverage-sees-a-dip-govt-says-students-are-shifting-to-private-schools/333210/
Senior IPS officer quits service in ‘civil disobedience’ against citizenship bill," 12 December, 2019 9:03 am IST",Sanya Dhingra,"Abdur Rahman, Citizenship (Amendment) Bill 2019, IPS Officer",https://theprint.in/india/senior-ips-officer-quits-service-in-civil-disobedience-against-citizenship-bill/333940/
"BJP is dividing Jharkhand tribals on religion, won’t win election: JMM chief Hemant Soren  "," 12 December, 2019 8:14 am IST",Moushumi Das Gupta,,https://theprint.in/india/bjp-is-dividing-jharkhand-tribals-on-religion-wont-win-election-jmm-chief-hemant-soren/333886/
Jammu & Kashmir High Court asks Home Ministry to deploy CAPF to secure court premises," 11 December, 2019 9:58 pm IST",PTI,"CAPF, Jammu & Kashmir, Jammu & Kashmir High Court, PTI wire",https://theprint.in/india/jammu-kashmir-high-court-asks-home-ministry-to-deploy-capf-to-secure-court-premises/333902/
Nanavati Commission discredits statements of 3 former IPS officers in 2002 riots case," 11 December, 2019 9:57 pm IST",PTI,"2002 riots, Godhra riots, Nanavati commission, PTI wire",https://theprint.in/india/nanavati-commission-discredits-statements-of-3-former-ips-officers-in-2002-riots-case/333839/
"Indefinite curfew in Guwahati, Army in Assam⁠— citizenship bill plunges Northeast in chaos"," 11 December, 2019 9:49 pm IST",PTI,"Assam, Citizenship Amendment Bill, Guwahati, Indian Army, PTI wire",https://theprint.in/india/indefinite-curfew-in-guwahati-army-in-assam%e2%81%a0-citizenship-bill-plunges-northeast-in-chaos/333869/
"India will never be Muslim-mukt nation, citizenship bill not to target community: Amit Shah"," 11 December, 2019 9:35 pm IST",Neelam Pandey,"Amit Shah, Citizenship (Amendment) Bill 2019, Indian Muslims",https://theprint.in/india/india-will-never-be-muslim-mukt-nation-citizenship-bill-not-to-target-community-amit-shah/333856/
"Rajya Sabha passes Citizenship (Amendment) Bill, govt assures Indian Muslims need not worry"," 11 December, 2019 9:29 pm IST",PTI,"Citizenship (Amendment) Bill 2019, Citizenship Amendment Bill, PTI wire, Rajya Sabha",https://theprint.in/india/governance/rajya-sabha-passes-citizenship-amendment-bill-govt-assures-indian-muslims-need-not-worry/333567/
Cabinet approves amendments to insolvency law to protect bidders from risks," 11 December, 2019 9:21 pm IST",PTI,"IBC, IBC amendment, PTI wire",https://theprint.in/india/governance/cabinet-approves-amendments-to-insolvency-law-to-protect-bidders-from-risks/333861/
‘Panipat’ producers agree to edit portions of film following protests by Jat groups," 11 December, 2019 9:04 pm IST",PTI,"Panipat, PTI wire, Rajasthan",https://theprint.in/india/panipat-producers-agree-to-edit-portions-of-film-following-protests-by-jat-groups/333840/
"‘Ditch car, catch bus’ — Bengaluru begins fightback to reclaim its roads from traffic jams"," 11 December, 2019 8:00 pm IST",Rohini Swamy,"Bengaluru, traffic jam",https://theprint.in/india/ditch-car-catch-bus-bengaluru-begins-fightback-to-reclaim-its-roads-from-traffic-jams/333796/
"Nirmohi Akhara files Ayodhya review plea, wants clarity on role in Ram temple construction"," 11 December, 2019 7:53 pm IST",Apoorva Mandhani,"Ayodhya verdict, Nirmohi Akhara, Ram mandir",https://theprint.in/india/governance/judiciary/nirmohi-akhara-files-ayodhya-review-plea-wants-clarity-on-role-in-ram-temple-construction/333810/
"BJP Assam MPs flag fear & confusion in state, say Modi govt pushed citizenship bill too fast"," 11 December, 2019 7:36 pm IST",Shanker Arnimesh,"Assam Accord, BJP, Citizenship (Amendment) Bill 2019",https://theprint.in/india/governance/bjp-assam-mps-flag-fear-confusion-in-state-say-modi-govt-pushed-citizenship-bill-too-fast/333790/
"Low caste, loose morals – UP’s ‘rape capital’ Unnao blames its victims for sex crimes"," 11 December, 2019 7:31 pm IST",Fatima Khan,"Crime Against Women, Unnao, Unnao Rape",https://theprint.in/india/low-caste-loose-morals-ups-rape-capital-unnao-blames-its-victims-for-sex-crimes/333638/
"In first court appearance after bail, advocate Chidambaram argues against his lawyers"," 11 December, 2019 7:09 pm IST",Apoorva Mandhani,"INX media case, Kapil Sibal, P. Chidambaram",https://theprint.in/india/governance/judiciary/in-first-court-appearance-after-bail-advocate-chidambaram-argues-against-his-lawyers/333753/
"Army in Tripura, on standby in Assam as citizenship bill protests intensify"," 11 December, 2019 6:36 pm IST",PTI,"Assam, Citizenship Amendment Bill, PTI wire",https://theprint.in/india/army-in-tripura-on-standby-in-assam-as-citizenship-bill-protests-intensify/333750/
JNU seeks Delhi High Court action against students and police for ‘violating’ court order," 11 December, 2019 6:33 pm IST",PTI,"Delhi High Court, JNU, PTI wire",https://theprint.in/india/governance/judiciary/jnu-seeks-delhi-high-court-action-against-students-and-police-for-violating-court-order/333762/
"Forget battle over the film, Panipat is at the heart of 3 battles that shaped our history"," 11 December, 2019 5:42 pm IST",Taran Deol,"Bollywood, Panipat, Third Battle of Panipat",https://theprint.in/india/forget-battle-over-the-film-panipat-is-at-the-heart-of-3-battles-that-shaped-our-history/333643/
"Govt deploys 5,000 paramilitary personnel in Northeast as citizenship bill protests continue"," 11 December, 2019 4:53 pm IST",PTI,"Citizenship (Amendment) Bill 2019, Northeast, PTI wire",https://theprint.in/india/govt-deploys-5000-paramilitary-personnel-in-northeast-as-citizenship-bill-protests-continue/333639/
Inner Line Permit extended to Manipur as citizenship bill protests disrupt Northeast region," 11 December, 2019 3:58 pm IST",PTI,"Citizenship Amendment Bill, Manipur, PTI wire",https://theprint.in/india/inner-line-permit-extended-to-manipur-as-citizenship-bill-protests-disrupt-northeast-region/333604/
"Nanavati panel’s clean chit exposes conspiracy against PM Modi, says BJP"," 11 December, 2019 3:41 pm IST",PTI,"2002 Gujarat riots, BJP, Narendra Modi, PTI wire",https://theprint.in/india/nanavati-panels-clean-chit-exposes-conspiracy-against-pm-modi-says-bjp/333596/
BJP has upper hand in Rajya Sabha as citizenship bill comes up for debate," 11 December, 2019 3:21 pm IST",Deeksha Bhardwaj,"Amit Shah, Citizenship (Amendment) Bill 2019, Rajya Sabha",https://theprint.in/india/governance/bjp-has-upper-hand-in-rajya-sabha-as-citizenship-bill-comes-up-for-debate/333461/
Pakistan court charges JuD chief Hafiz Saeed of ‘terror financing’," 11 December, 2019 2:11 pm IST",M Zulqernain,"2008 Mumbai attacks, Hafiz Saeed, Jammat-ud-Dawa, Lashkar-e-Taiba, PTI wire",https://theprint.in/india/pakistan-court-charges-jud-chief-hafiz-saeed-of-terror-financing/333524/
Rajya Sabha TV briefly stops live telecast of citizenship bill debate on Chairman’s orders," 11 December, 2019 1:47 pm IST",PTI,"Citizenship (Amendment) Bill 2019, PTI wire, Rajya Sabha TV",https://theprint.in/india/rajya-sabha-tv-briefly-stops-live-telecast-of-citizenship-bill-debate-on-chairmans-orders/333505/
Modi’s Gujarat govt gets clean chit from Nanavati Commission in 2002 riots case," 11 December, 2019 1:18 pm IST",PTI,"2002 Gujarat riots, PM Modi, PTI wire",https://theprint.in/india/modis-gujarat-govt-gets-clean-chit-from-nanavati-commission-in-2002-riots-case/333459/
"Amit Shah moves citizenship bill in Rajya Sabha, says Indian Muslims will remain citizens"," 11 December, 2019 1:12 pm IST",PTI,"Amit Shah, Citizenship (Amendment) Bill 2019, PTI wire, Rajya Sabha",https://theprint.in/india/amit-shah-moves-citizenship-bill-in-rajya-sabha-says-indian-muslims-will-remain-citizens/333453/
"Citizenship bill protests forces railways to cancel, reschedule trains"," 11 December, 2019 12:50 pm IST",PTI,"Assam, Citizenship (Amendment) Bill 2019, Northeast Frontier Railway, PTI wire",https://theprint.in/india/citizenship-bill-protests-forces-railways-to-cancel-reschedule-trains/333435/
Indian Army’s Northern Command in Kashmir Valley gets American assault rifles," 11 December, 2019 12:36 pm IST",ANI,"ANI wire, Indian Army, Kashmir Valley",https://theprint.in/india/indian-armys-northern-command-in-kashmir-valley-gets-american-assault-rifles/333432/
Seven ways Economics can change in the 2020s," 11 December, 2019 12:32 pm IST",Noah Smith,"Bloomberg wire, Economic reforms, economics, World Economic Forum",https://theprint.in/india/seven-ways-economics-can-change-in-the-2020s/333430/
PM Modi says opposition is speaking Pakistan’s language on citizenship bill," 11 December, 2019 11:20 am IST",PTI,"Citizenship (Amendment) Bill 2019, PM Modi, PTI wire",https://theprint.in/india/pm-modi-says-opposition-is-speaking-pakistans-language-on-citizenship-bill/333415/
RSS has a new global Hindutva mascot — Nobel laureate Sir VS Naipaul," 11 December, 2019 10:58 am IST",Rahul Sampal,"RSS, V.S. Naipaul",https://theprint.in/india/rss-has-a-new-global-hindutva-mascot-nobel-laureate-sir-vs-naipaul/333252/
"600 writers, activists, ex-judges ask Modi govt to withdraw ‘divisive’ citizenship bill"," 11 December, 2019 10:07 am IST",PTI,"Amit Shah, Citizenship (Amendment) Bill 2019, Lok Sabha, PTI wire",https://theprint.in/india/600-writers-activists-ex-judges-ask-modi-govt-to-withdraw-divisive-citizenship-bill/333359/
Modi govt to slash IPS posts by 50% at Centre as ‘states refuse to spare them’," 11 December, 2019 8:16 am IST",Sanya Dhingra,"Civil Services, IPS officers, Union Home Ministry",https://theprint.in/india/governance/modi-govt-to-slash-ips-posts-by-50-at-centre-as-states-refuse-to-spare-them/333212/
"Threat of sanctions didn’t work in Vajpayee’s time, won’t work now: VHP on citizenship bill"," 10 December, 2019 10:34 pm IST",PTI,"Amit Shah, Citizenship (Amendment) Bill 2019, PTI wire",https://theprint.in/india/threat-of-sanctions-didnt-work-during-vajpayees-time-wont-deter-india-now-vhp-on-citizenship-bill/333334/
"Call for lynching of rapists shows mob mentality prevailing in society, says ex-CJI Lodha"," 10 December, 2019 9:26 pm IST",Apoorva Mandhani,"human rights, Hyderabad encounter, Supreme Court",https://theprint.in/india/call-for-lynching-rapists-shows-mob-mentality-prevailing-in-society-ex-cji-lodha/333287/
"JNU students protesting fee hike get govt assurance, but unsure if university will toe line"," 10 December, 2019 9:13 pm IST",Kritika Sharma,"JNU, JNU hostel fee hike",https://theprint.in/india/education/jnu-students-protesting-fee-hike-get-govt-assurance-but-unsure-if-university-will-toe-line/333278/
"Data protection bill exempts govt agencies from law, set to be tabled in Lok Sabha tomorrow"," 10 December, 2019 8:40 pm IST",Maneesh Chhibber,"Data protection bill, Lok Sabha, Modi govt 2019",https://theprint.in/india/governance/data-protection-bill-to-be-introduced-in-lok-sabha-tomorrow-contentious-clauses-added/333269/
"IIMC alumni write to I&B ministry over 100% hike in fees in 10 years, demand roll back"," 10 December, 2019 8:27 pm IST",PTI,"fee hike, IIMC, JNU protest",https://theprint.in/india/education/iimc-alumni-write-to-ib-ministry-over-100-hike-in-fees-in-10-years-demand-roll-back/333261/
"Aurangabad IAS officer slaps another Rs 5000-fine, this time for plastic gift wrapping"," 10 December, 2019 8:19 pm IST",PTI,"Aurangabad, Maharashtra plastic ban, Plastic ban, PTI wire",https://theprint.in/india/aurangabad-ias-officer-slaps-another-rs-5000-fine-this-time-for-plastic-gift-wrapping/333268/
"India will review RCEP trade pact with ASEAN countries, Piyush Goyal tells Rajya Sabha"," 10 December, 2019 7:15 pm IST",PTI,"ASEAN, PTI wire, RCEP",https://theprint.in/india/india-will-review-rcep-trade-pact-with-asean-countries-piyush-goyal-tells-rajya-sabha/333214/
Outsiders could soon apply to J&K medical colleges under NEET and students are worried," 10 December, 2019 6:17 pm IST",Kritika Sharma,"Article 370, Education, Jammu and Kashmir, NEET",https://theprint.in/india/education/outsiders-soon-apply-to-jk-medical-colleges-under-neet-students-worried/333197/
"Capping profits will wipe out low-cost generic medicines, drugmakers write to PM Modi"," 10 December, 2019 5:13 pm IST",Himani Chandna,"Generic drugs, MCI, Pharmaceutical industry",https://theprint.in/india/capping-profits-will-wipe-out-low-cost-generic-medicines-drugmakers-write-to-pm-modi/333088/
"Unnao rape victim’s family stop local officials from cementing grave, demand justice first"," 10 December, 2019 4:53 pm IST",PTI,"PTI wire, Unnao, Unnao gangrape",https://theprint.in/india/unnao-rape-victims-family-stop-local-officials-from-cementing-grave-demand-justice-first/333083/
How foreign media criticised citizenship bill being passed in Lok Sabha," 10 December, 2019 4:35 pm IST",Taran Deol,"Citizenship (Amendment) Bill 2019, International media",https://theprint.in/india/how-foreign-media-criticised-citizenship-bill-being-passed-in-lok-sabha/333050/
"Unnao rape victim’s family stop local officials from cementing grave, demand justice first"," 10 December, 2019 4:53 pm IST",PTI,"PTI wire, Unnao, Unnao gangrape",https://theprint.in/india/unnao-rape-victims-family-stop-local-officials-from-cementing-grave-demand-justice-first/333083/
How foreign media criticised citizenship bill being passed in Lok Sabha," 10 December, 2019 4:35 pm IST",Taran Deol,"Citizenship (Amendment) Bill 2019, International media",https://theprint.in/india/how-foreign-media-criticised-citizenship-bill-being-passed-in-lok-sabha/333050/
"BHU Muslim professor, who faced student protests, quits Sanskrit dept & joins Arts faculty"," 10 December, 2019 3:49 pm IST",PTI,"Banaras Hindu University, Muslim professor, PTI wire, Sanskrit department",https://theprint.in/india/bhu-muslim-professor-who-faced-student-protests-quits-sanskrit-dept-joins-arts-faculty/332960/
Sri Sri Ravi Shankar bats for citizenship of Sri Lankan Tamil refugees amid NRC-CAB debate," 10 December, 2019 3:46 pm IST",PTI,"Citizenship Amendment Bill, PTI wire, Sri Sri Ravi Shankar, Tamil",https://theprint.in/india/sri-sri-ravi-shankar-bats-for-citizenship-of-sri-lankan-tamil-refugees-amid-nrc-cab-debate/332991/
"Citizenship bill a dangerous turn: US panel for religious freedoms targets Amit Shah, govt"," 10 December, 2019 3:17 pm IST",ThePrint Team,"Amit Shah, Citizenship Amendment Bill, Lok Sabha",https://theprint.in/india/citizenship-bill-a-dangerous-turn-us-panel-for-religious-freedoms-targets-amit-shah-govt/332921/
Religious exclusion may not satisfy touchstone of constitutional provisions: Ex-CJI Lodha," 10 December, 2019 2:19 pm IST",Sunetra Choudhury,"Amit Shah, Citizenship (Amendment) Bill 2019, Hyderabad rape, Justice RM Lodha",https://theprint.in/india/religious-exclusion-may-not-satisfy-touchstone-of-constitutional-provisions-ex-cji-lodha/332952/
"UGC to launch 10 women-centric academic chairs, Subbulakshmi & Ahilyabai Holkar on list"," 10 December, 2019 12:41 pm IST",Kritika Sharma,"higher education, UGC chairs, University Grants Commission (UGC)",https://theprint.in/india/education/ugc-to-launch-10-women-centric-academic-chairs-subbulakshmi-ahilyabai-holkar-on-list/332758/
"After 7-hr debate, Lok Sabha passes Citizenship (Amendment) Bill"," 10 December, 2019 8:48 am IST",PTI,"Citizenship (Amendment) Bill 2019, Lok Sabha, PTI wire",https://theprint.in/india/after-7-hr-debate-lok-sabha-passes-citizenship-amendment-bill/332814/
"Protests erupt in Northeast, bandh declared as Amit Shah tables citizenship bill"," 9 December, 2019 10:15 pm IST",PTI,"Amit Shah, Assam, Citizenship (Amendment) Bill 2019, PTI wire, Tripura",https://theprint.in/india/protests-erupt-in-northeast-bandh-declared-as-amit-shah-tables-citizenship-bill/332775/
Govt further limits retailers from stocking onions to 2 tonnes," 9 December, 2019 10:03 pm IST",PTI,"Onion, onion prices",https://theprint.in/india/govt-further-limits-retailers-from-stocking-onions-to-2-tonnes/332767/
